{"$id":"https://schemas.yeisme.dev/video/product-promo-brief/v1","$schema":"https://json-schema.org/draft/2020-12/schema","additionalProperties":false,"properties":{"audience":{"type":"string"},"brand_motion_lens":{"type":"object"},"confirmed_decisions":{"items":{"type":"string"},"type":"array"},"creative_mode":{"enum":["template_adaptation","agent_directed","guided_collaboration"]},"creative_proposals":{"items":{"additionalProperties":false,"properties":{"affected_fields":{"items":{"type":"string"},"type":"array"},"proposal":{"type":"string"},"rationale":{"type":"string"}},"required":["proposal","rationale","affected_fields"],"type":"object"},"type":"array"},"data_and_rights":{"type":"object"},"delivery":{"type":"object"},"feature_priorities":{"items":{"additionalProperties":false,"properties":{"evidence_source_ids":{"items":{"type":"string"},"type":"array"},"feature_or_message":{"type":"string"},"priority":{"minimum":1,"type":"integer"},"reason":{"type":"string"}},"required":["feature_or_message","priority","evidence_source_ids","reason"],"type":"object"},"type":"array"},"intended_outcome":{"type":"string"},"product_facts":{"items":{"additionalProperties":false,"properties":{"fact":{"type":"string"},"source_id":{"type":"string"}},"required":["fact","source_id"],"type":"object"},"type":"array"},"schema_version":{"const":"product_promo_brief.v1"},"unknowns":{"items":{"type":"string"},"type":"array"},"unresolved_decisions":{"items":{"type":"string"},"maxItems":3,"type":"array"}},"required":["schema_version","product_facts","unknowns","audience","intended_outcome","creative_mode","feature_priorities","brand_motion_lens","data_and_rights","delivery","confirmed_decisions","creative_proposals","unresolved_decisions"],"type":"object"}