{"audience":"Product teams evaluating a local project workspace","brand_motion_lens":{"tone":["precise","calm","tactile"]},"confirmed_decisions":["guided collaboration","synthetic demo data","30 seconds","16:9","Chinese captions"],"creative_mode":"guided_collaboration","creative_proposals":[],"data_and_rights":{"audio":"verified_files_only","data":"synthetic_or_redacted","remotion_license":"review_required"},"delivery":{"aspect_ratio":"16:9","audio":"sfx_only","captions":true,"duration_seconds":30,"editable_timeline":true,"frame_rate":30,"language":"zh-CN"},"feature_priorities":[{"evidence_source_ids":["product-readme"],"feature_or_message":"Project board","priority":1,"reason":"Primary workspace"}],"intended_outcome":"Explain the board-search-review workflow","product_facts":[{"fact":"Atlas Desk organizes project notes and tasks in one local workspace.","source_id":"product-readme"}],"schema_version":"product_promo_brief.v1","unknowns":[],"unresolved_decisions":[]}